{
  "$schema": "http://json-schema.org/draft-04/schema#",
  "description": "Schema for the response by the bill search  service",
  "$ref": "#/definitions/BillSearchResponse",
  "definitions": {
    "BillSearchResponse": {
      "type": "object",
      "properties": {
        "totalNumberOfBills": {
          "description": "Total Number Of Bills  for provided search criteria",
          "type": "number"
        },
        "totalNumberOfPages": {
          "description": "Total Number Of Pages for provided search criteria",
          "type": "number"
        },
        "currentPageNumber": {
          "description": "Current Page Number for provided search criteria ",
          "type": "number"
        },
        "searchedParameters": {
          "description": "valid  parameters used in search",
          "type": "array",
          "items": {
            "$ref": "#/definitions/Parameter"
          }
        },
        "warnings": {
          "description": "validation problems  encountered  in search",
          "type": "array",
          "items": {
            "$ref": "#/definitions/Warning"
          }
        },
        "bills": {
          "type": "array",
          "items": {
            "$ref": "#/definitions/Bill"
          }
        }
      },
      "additionalProperties": false
    },
    "Parameter": {
      "type": "object",
      "properties": {
        "field ": {
          "type": "string"
        },
        "value ": {
          "type": "string"
        }
      }
    },
    "Warning": {
      "type": "object",
      "properties": {
        "message  ": {
          "type": "string"
        },
        "field ": {
          "type": "string"
        },
        "value ": {
          "type": "string"
        }
      }
    },
    "Bill": {
      "type": "object",
      "properties": {
        "billingAccount": {
          "description": "Contains billing account (EPA site id).",
          "type": "string"
        },
        "billId": {
          "description": "Contains bill id",
          "type": "number"
        },
        "billStatus": {
          "description": " Contains bill status.",
          "type": "string",
          "enum": [
            "Unpaid",
            "InProgress",
            "ReadyForPayment",
            "Paid",
            "SentToCollections",
            "Credit",
            "ZeroBalance"
          ]
        },
        "paymentType": {
          "description": " Contains bill payment type ",
          "type": "string",
          "enum": [
            "Credit",
            "Ach"
          ]
        },
        "totalAmount": {
          "description": "Contains bill total amount. ",
          "type": "number"
        },
        "currentAmount": {
          "description": "Contains bill current amount. ",
          "type": "number"
        },
        "previousAmount": {
          "description": "Contains previous months total current amounts. ",
          "type": "number"
        },
        "previousInterestAmount": {
          "description": "Contains previous months total interest amounts. ",
          "type": "number"
        },
        "previousFlatFeeAmount": {
            "description": "Contains previous months total flat fee amounts. ",
          "type": "number"     
        },
        "previousPenaltyAmount": {
          "description": "Contains previous months total penalty amounts. ",
          "type": "number"
        },
        "previousLateFeeAmount": {
          "description": "Contains previous months total Late Fee amounts. ",
          "type": "number"
        },
        "dueDate": {
          "description": "Contains due date. ",
          "type": "string",
          "format": "date"
        },
        "paidBy": {
          "description": "Contains the bill payee user id",
          "type": "string"
        },
        "createdDate": {
          "description": "Contains the creation date of the bill",
          "type": "string",
          "format": "date-time"
        },
        "updatedDate": {
          "description": "Contains the update date of the bill.",
          "type": "string",
          "format": "date-time"
        },
        "lateFees": {
          "description": "contains list of late fees",
          "type": "array",
          "items": {
            "$ref": "#/definitions/LateFee"
          }
        },
        "revisions": {
          "description": "contains list of revisions",
          "type": "array",
          "items": {
            "$ref": "#/definitions/Revision"
          }
        },
        "recalculationsInfo": {
          "description": "contains list of Recalculations",
          "type": "array",
          "items": {
            "$ref": "#/definitions/RecalculationInfo"
          }
        },
        "totalAmountChanged ": {
          "description": "if true the totalAmount has been changed from the original calculated amount at the beginning of the month",
          "type": "boolean"
        }
      },
      "additionalProperties": false
    },
    "LateFee": {
      "type": "object",
      "properties": {
        "interestAmount": {
          "description": "Contains calculated interest amount. ",
          "type": "number"
        },
        "penaltyAmount": {
          "description": "Contains calculated penalty amount. ",
          "type": "number"
        },
        "lateFeeAmount": {
          "description": "Contains calculated late fee amount.",
          "type": "number"
        },
        "flatFeeAmount": {
          "description": "Contains calculated flat fee amount.",
          "type": "number"
        },
        "status": {
          "description": " Contains status. Industry cannot see lateFees records where status = Inactive ",
          "type": "string",
          "enum": [
            "Active",
            "Inactive"
          ]
        },
        "lateFeeBillId": {
          "description": "foreign key to the Bill which Late Fee is calculated for",
          "type": "number"
        }
      },
      "additionalProperties": false
    },
    "Revision": {
      "type": "object",
      "properties": {
        "amount": {
          "description": "Contains either Bill Current or Bill Late fee or Total adjusted absolute amount. ",
          "type": "number"
        },
        "billId": {
          "description": "Contains bill id",
          "type": "number"
        },
        "amountType": {
          "description": "Specifies what amount (Current or late fee or Total) was adjusted",
          "type": "string",
          "enum": [
            "Previous",
            "Current",
            "LateFee",
            "LateFeeInterest",
            "LateFeePenalty",
            "LateFeeFlatFee",
            "Total"
          ]
        },
        "adjustmentType": {
          "description": "Specifies how the amount was adjusted",
          "type": "string",
          "enum": [
            "Increase",
            "Decrease",
            "FullPayment"
          ]
        },
        "publicComments": {
          "description": "adjustment comments",
          "type": "string"
        },
        "createdDate": {
          "description": "Contains the adjustment creation date",
          "type": "string",
          "format": "date-time"
        }
      },
      "additionalProperties": false
    },
    "RecalculationInfo": {
      "type": "object",
      "properties": {
        "recalculationReason ": {
          "type": "string",
          "enum": [
            "OriginalSiteBill",
            "NewSiteBill"
          ]
        }
      },
      "additionalProperties": false
    }
  }
}